Client,Date,Title,Category,Hours,CategoryCap,DailyTotal,Flags,Reasons
AFFG,2026-03-17,American Fundstars Financial Group LLC (AFFG) New Client Onboarding,Routine: Onboarding / Offboarding,3.33,3.0,3.33,H1,routine > 3.0h cap (Onboarding / Offboarding)
VAF,2026-04-16,"Device Non-Compliant Due to Missing Patches-VAF-DC-3CX-01, VAF-DC-TS-01, VAF-DC-FS-01, VAF-DC-SQL-01, VAF-DC-FS-02, VAF-DC-OPSPRB, VAF-DC-AD-01, and VAF-DC-SFTP-02.",Routine: Patch management / Windows Update,2.25,1.5,2.25,H1,routine > 1.5h cap (Patch management / Windows Update)
ORX,2026-03-22,"Device Non-Compliant Due to Missing Patches ORX-DC-VDI-005, ORX-DC-APP-04, ORX-DC-FS-02 ,ORX-DC-SQL-01 ,ORX-DC-OPSPRB & ORX-DC-TS-03",Routine: Patch management / Windows Update,2.0,1.5,2.0,H1,routine > 1.5h cap (Patch management / Windows Update)
ORX,2026-02-09,Update failed patches on the computer WKORX-01  WKORX-07  WKORX-10  WKORX-04  WKORX54  WKORX43  WKORX42,Routine: Patch management / Windows Update,1.92,1.5,1.92,H1,routine > 1.5h cap (Patch management / Windows Update)
ORX,2026-03-30,"WKORX45,WKORX35,WKORX37,WKORX72 & WKORX49 has Missing patch while last run",Routine: Patch management / Windows Update,1.83,1.5,1.83,H1,routine > 1.5h cap (Patch management / Windows Update)
ORX,2026-02-16,"Installed the missing patches on the following systems JRMED08,JRMED10,WKORX30,JRMED07,Margaret,WKORX-10,WKORX43",Routine: Patch management / Windows Update,1.7,1.5,1.7,H1,routine > 1.5h cap (Patch management / Windows Update)
ORX,2026-01-27,TRYING TO OBTAIN VOICEMAIL FROM PHONE,Routine: Phone / Voice / Teams,1.58,1.5,2.91,H1,routine > 1.5h cap (Phone / Voice / Teams)
VAF,2026-04-02,"VAF-HQ-SUR-13,VAF-HQ-MCX-01,VAF-DC-TS-01,VAF-DC-OPSPRB, & VAF-HQ-LT-35 has Missing patch while last run",Routine: Patch management / Windows Update,1.58,1.5,3.0,H1,routine > 1.5h cap (Patch management / Windows Update)
ORX,2026-02-17,"Screenconnect Latest version  (V 25.9.9.9533)  updated on machine JRMEDSVR01,ORX-DC-3CX-01,ORX-DC-AD-03 & ORX-DC-AD-04",Routine: ScreenConnect / MyRemote updates,1.02,1.0,1.35,H1,routine > 1.0h cap (ScreenConnect / MyRemote updates)
